id,sequence,label,date,quarter,year,speaker,title,text,mystery indicator,VADER sentiment
DHI-2021-Q1-2021-01-26,99,Question,2021-01-26,1,2021,Bill W. Wheat,"CFO, Principal Accounting Officer & Executive VP","And number two, just the color around the lots you added during the quarter, kind of duration of those lots, lot inflation, any of that could actually impact 2021? Thank you.",0.9692183,0.71
DHI-2021-Q1-2021-01-26,100,Answer,2021-01-26,1,2021,Bill W. Wheat,"CFO, Principal Accounting Officer & Executive VP","Sure. And Matt, you'll notice that most of that addition to the lot position did come in the form of options lots. We continue to significantly increase our option lot position. We had noted on our last call that we do expect our own lot to increase modestly, and they did kind of get back to a normal level there.",0.5743216,0.67
DHI-2021-Q1-2021-01-26,101,Answer,2021-01-26,1,2021,Bill W. Wheat,"CFO, Principal Accounting Officer & Executive VP","But we've been on an ongoing effort to expand our relationships with developers across the country. Of course, our relationship with Forestar continues to bear fruit as well. So, a significant portion of the additions to our lot position through options came from our third-party developers and our relationship with Forestar.",0.3309032,0.883
DHI-2021-Q1-2021-01-26,102,Answer,2021-01-26,1,2021,David V. Auld,President & Chief Executive Officer,"And with the significant growth we've seen in demand and significant volume increases that we've seen, that we certainly want to make sure we stay in position to maintain. We probably have stepped up our efforts to ensure that we're keeping our pipeline sufficiently out in front of us with the volume we're seeing today.",0.403232,0.783
DHI-2021-Q1-2021-01-26,103,Answer,2021-01-26,1,2021,Bill W. Wheat,"CFO, Principal Accounting Officer & Executive VP","The volume we see today, Matt, as well as looking forward to more medium term, we just don't see a lot of overbuilding, a lot of excess supply in the marketplace relative to household formation demand. And so we want to maintain, as Bill said, adequate support of inventory for that medium term land. So that's why you're seeing our controlled lot position increased.",0.4657756,0.074
DHI-2021-Q1-2021-01-26,105,Answer,2021-01-26,1,2021,David V. Auld,President & Chief Executive Officer,Very capital-efficient with the options.,0.6794921,0.897
DHI-2021-Q1-2021-01-26,107,Question,2021-01-26,1,2021,Bill W. Wheat,"CFO, Principal Accounting Officer & Executive VP","But then number two, if I look at the closings and revenue guidance for the year, it seems to suggest that the closing ASPs settled back down a little bit. I'm just wondering if you can reconcile that and just how to think about closing ASPs for the year. Thank you.",0.963548,0.904
DHI-2021-Q1-2021-01-26,108,Answer,2021-01-26,1,2021,Bill W. Wheat,"CFO, Principal Accounting Officer & Executive VP","Yeah, sure. We always see a higher ASP in our backlog than we do in our sales and our closings because higher priced homes generally are bigger and take longer to work their way through. So that's not necessarily unusual. But yes, so with our sales ASP being at 314 in this quarter, that's definitely showing a continuation of some price appreciation. And so in the near term, we would expect, I think to probably still see some potential upside.",0.6103686,0.439
DHI-2021-Q1-2021-01-26,109,Answer,2021-01-26,1,2021,Bill W. Wheat,"CFO, Principal Accounting Officer & Executive VP","That been said, our operators and our teams and our people are very focused on providing affordability. And so we're going to keep an eye on the price points and the payments that our buyers need to have to afford to move into our homes.",1.1024706,0.613
DHI-2021-Q1-2021-01-26,110,Answer,2021-01-26,1,2021,Jessica L. Hansen,Vice President-Investor Relations & Communications,"And so we never plan for significant price appreciation beyond a quarter or two because we always know that at some point, we will make some adjustments in our operations to make sure we keep our price points affordable.",1.8071088,0.0
DHI-2021-Q1-2021-01-26,112,Question,2021-01-26,1,2021,Bill W. Wheat,"CFO, Principal Accounting Officer & Executive VP",Okay. Got it.,0.4131227,0.0
DHI-2021-Q1-2021-01-26,115,Answer,2021-01-26,1,2021,Bill W. Wheat,"CFO, Principal Accounting Officer & Executive VP",Thank you.,0.7492912,0.318
DHI-2021-Q1-2021-01-26,118,Answer,2021-01-26,1,2021,Jessica L. Hansen,Vice President-Investor Relations & Communications,Good morning.,0.3602081,0.718
DHI-2021-Q1-2021-01-26,119,Question,2021-01-26,1,2021,Michael J. Murray,Chief Operating Officer & Executive Vice President,"The increase - the increased delivery number for the year, curious what changed and where that changed and thinking a bit of geography and mix and also the production pace, but just sort of the things that changed that have resulted in you taken a little bit more optimistic on full year deliveries?",0.9987442,0.932
DHI-2021-Q1-2021-01-26,120,Answer,2021-01-26,1,2021,David V. Auld,President & Chief Executive Officer,"I think we've seen consistently strong demand across our footprint, Eric. In addition, as we've gotten the starts up in the first quarter, we started almost 23,000 homes with good visibility to start for the next couple of quarters. And so that gives us more confidence in the number we can deliver for the full year. So just a little clear - a little more of a year coming into focus with what we're going to be able to accomplish.",0.4474798,0.917
DHI-2021-Q1-2021-01-26,121,Answer,2021-01-26,1,2021,David V. Auld,President & Chief Executive Officer,"We're also seeing a good start to the spring in January, which again, it's about confidence. And we don't want to put a number out there that we don't feel really good about. So we feel really good about that number.",0.4386302,0.226
DHI-2021-Q1-2021-01-26,122,Question,2021-01-26,1,2021,Michael J. Murray,Chief Operating Officer & Executive Vice President,"From a production pace and inventory pace, anything different that you're doing there or have done there to also allow you to get more homes produced?",0.3432398,0.649
DHI-2021-Q1-2021-01-26,123,Answer,2021-01-26,1,2021,Michael J. Murray,Chief Operating Officer & Executive Vice President,"Anything different. It's - we talk about sustainability and growing the scale of our platform and doing it in a measured approach that allows us to hang on to those increases. So I wouldn't say, it's anything different. It's just further execution of the same strategy of growing our capacity for production, growing our market share market-by-market.",1.525743,0.383
DHI-2021-Q1-2021-01-26,126,Answer,2021-01-26,1,2021,Michael J. Murray,Chief Operating Officer & Executive Vice President,"Thanks, Eric.",1.3478443,0.318
DHI-2021-Q1-2021-01-26,130,Question,2021-01-26,1,2021,David V. Auld,President & Chief Executive Officer,"So I'm curious, as you look at the composition of the land you've tied up over the last 12 months, could you talk a little bit about how you're thinking about underwriting to gross margin to return on inventory to absorption whatever metrics you guys think about internally? And how that compares to where you're generating business today?",0.4647942,0.166
DHI-2021-Q1-2021-01-26,131,Answer,2021-01-26,1,2021,David V. Auld,President & Chief Executive Officer,"Our underwriting really hasn't changed much as we've seen absorptions increase, it does - when we're requiring a two-year cash back at a 10 a month absorption, you can buy more lots than you can a five a month absorption. So we have seen the scale of the deals get a little bigger, but the position that from a pricing and location standpoint, I don't see that we've given up much in the deals we're doing today versus the deals we were doing two or three, four years ago.",0.1346672,0.94
DHI-2021-Q1-2021-01-26,132,Answer,2021-01-26,1,2021,David V. Auld,President & Chief Executive Officer,"Scale is bigger. The phase sizes are bigger. Lot prices have been pretty stable. And I think I said this on the last call, when I'm traveling and looking at deals, the deals that we put on the books this quarter, we're better than most of the deals that we had on the books. So it's very - it gives me a lot of confidence, and our guys are doing a great job. So I don't see deterioration in our lot position from marketability or really even a pricing standpoint.",1.3505194,0.84
DHI-2021-Q1-2021-01-26,134,Question,2021-01-26,1,2021,Jessica L. Hansen,Vice President-Investor Relations & Communications,"But I'm just curious, what's driving that deceleration in the back half, because your backlog is going to be a very strong - strongly. So is this a function of conservatism around cycle times and just the backlog conversions might be a bit lower than years past because of how elevated the backlogs are? Or is there something else that's driving maybe that you sell in the back half?",1.1538795,0.0
DHI-2021-Q1-2021-01-26,135,Answer,2021-01-26,1,2021,Jessica L. Hansen,Vice President-Investor Relations & Communications,"It's really the stage of construction our homes are in Alan. We have a lot fewer completed specs today than we typically have. And as a result, we're selling and closing fewer homes intra-quarter than we typically would. I think that quarter that was in the 20 - mid-20% range and typically it's in the high 30% or 40% range.",1.0021673,0.827
DHI-2021-Q1-2021-01-26,136,Answer,2021-01-26,1,2021,Michael J. Murray,Chief Operating Officer & Executive Vice President,"So it's really just a function of the stage of our inventory. And we did get, as Mike said, almost 23,000 homes started this quarter, but a lot of those are still in the early stages of construction. And so a lot of the homes that we'll be starting here a little bit later in the year won't be available for this fiscal year, but they'll put us in a very good position to continue growth in fiscal 2022.",0.6542486,0.918
DHI-2021-Q1-2021-01-26,137,Answer,2021-01-26,1,2021,Michael J. Murray,Chief Operating Officer & Executive Vice President,"And when you look, obviously, at the year-over-year increases, we started to see some very significant year-over-year increases in Q3. Last year, Q3 and Q4 were much more significant. So the year-over-year increases going forward are naturally not going to necessarily continue at the same pace they are right now. But we're still expecting a very strong year, very strong year-over-year increase for fiscal '21.",2.0845542,0.925
DHI-2021-Q1-2021-01-26,142,Question,2021-01-26,1,2021,Jessica L. Hansen,Vice President-Investor Relations & Communications,"But if home price appreciation were to moderate obviously, today, it's in a, let's call it, a high single-digit type of year-over-year dynamic on a same store basis. If that were to moderate more to like a low single-digit rate, given where you're underwriting the deals to today, should we expect that gross margin to come in a little bit over the next couple of years? Is that the right way to think about it? Or are there other factors that maybe we're not appreciating?",0.6736021,0.23
DHI-2021-Q1-2021-01-26,143,Answer,2021-01-26,1,2021,Jessica L. Hansen,Vice President-Investor Relations & Communications,"We really have no insight to gross margin in the next few years. I mean, gross margin really is a function of the market, Mike. We're focused on underwritings to returns. And although we don't see it right now. Even if we did see a compression in our gross margins for whatever reason, affordability, interest rate, something that we don't foresee today as an issue, we can still generate very attractive returns on our current land, bank with the efficiencies that David's kind of already talked to in our business today and our ability to keep turning our houses.",0.4993498,0.812
DHI-2021-Q1-2021-01-26,144,Answer,2021-01-26,1,2021,Bill W. Wheat,"CFO, Principal Accounting Officer & Executive VP","But we feel very comfortable with our current lot position that we are going to be able to offset costs going forward and hopefully hang in around this 24% range. But really further than a quarter out, we don't have a whole lot of visibility because we do turn our houses much more quickly, I think, than the industry by and large. And so we have the best early read on cost and gross margin in the market.",0.6419603,-0.586
DHI-2021-Q1-2021-01-26,145,Answer,2021-01-26,1,2021,David V. Auld,President & Chief Executive Officer,"Can't emphasize enough that gross margin is not part of our underwriting hurdles, returns is our underwriting hurdle. And certainly, higher gross margins can generate higher returns. But we focus, first and foremost, on hitting returns, hitting our absorptions in each community. And then the market, sometimes will give you more margin than you may have underwritten.",0.3724509,0.0
DHI-2021-Q1-2021-01-26,146,Answer,2021-01-26,1,2021,David V. Auld,President & Chief Executive Officer,"If you look at our average sales price, we are significantly more affordable than most of our peers in the homebuilding space. And our land portfolio and our operating structures are designed and geared to drive that affordability.",0.2323971,0.598
DHI-2021-Q1-2021-01-26,147,Answer,2021-01-26,1,2021,David V. Auld,President & Chief Executive Officer,"So are we - when I look at the competitive makeup out there, both of the resale market, which is really, today, our primary competitor at this price points? And our peers in the industry, it's - I mean, we feel very good about our current position and which allows us to underwrite and execute the positions that we believe will keep us in this range.",0.876491,0.527
DHI-2021-Q1-2021-01-26,150,Question,2021-01-26,1,2021,Bill W. Wheat,"CFO, Principal Accounting Officer & Executive VP","So just wondering if there was anything specific to the first quarter, and I apologize if I missed this earlier, that benefited this past quarter more on a one-time basis? Or what kind of drove that differential?",0.1765897,0.891
DHI-2021-Q1-2021-01-26,151,Answer,2021-01-26,1,2021,Jessica L. Hansen,Vice President-Investor Relations & Communications,"Michael, thank you. You touched on part of it. Deliveries were a little bit ahead of what we had guided to. In addition to ASP is a little higher, which drives a little more SG&A leverage. Something Jessica touched on before is the lower level of completed inventory, especially the completed specs that we're carrying the business today, able to operate the inventory portfolio very efficiently. And that requires less SG&A to maintain and care for those homes while they're sitting completed because we do run those costs through SG&A. So as we have less of those, we had around 5,000 a year ago. And today, we have about 1,600. So that's - that's an improvement and a tailwind as well.",0.4243606,0.637
DHI-2021-Q1-2021-01-26,152,Answer,2021-01-26,1,2021,Jessica L. Hansen,Vice President-Investor Relations & Communications,"And although we guided to flat SG&A sequentially, on a year-over-year basis, it would actually be approximately 40 basis points of leverage, which is still a pretty nice move. And when we think about it on an annual basis, as our SG&A is already at record lows, we're not going to ever just be able to model and say that our SG&A is going to be down more than, say, that on an annual basis.",1.0689207,0.836
DHI-2021-Q1-2021-01-26,153,Answer,2021-01-26,1,2021,Bill W. Wheat,"CFO, Principal Accounting Officer & Executive VP","Can we ultimately maybe get there if you continue see prices rising ASP plays a big role in that? Sure. But right now, we feel like leveraging our SG&A 40 basis points on a year-over-year basis is a really nice move.",0.7938437,-0.16
DHI-2021-Q1-2021-01-26,156,Answer,2021-01-26,1,2021,Jessica L. Hansen,Vice President-Investor Relations & Communications,"Thanks, Mike.",0.4841786,0.318
DHI-2021-Q1-2021-01-26,159,Question,2021-01-26,1,2021,David V. Auld,President & Chief Executive Officer,"But in your last quarter, obviously, vaccine news, there's some hope out there. Is there anything you can - you've seen in terms of the traffic? Or what folks are looking for, how it's evolving that give us any insights in to, how your home buyers are looking at things?",0.5986918,0.807
DHI-2021-Q1-2021-01-26,160,Answer,2021-01-26,1,2021,Jessica L. Hansen,Vice President-Investor Relations & Communications,"The demand out there, I think, is really driven by demographics. And I think it has been accelerated, because of the pandemic and people's desire to become - or to find a safe environment for their family. I really don't see that demand issue changing. I mean, it's - it accelerates. It's a long-term program, and it got accelerated. Now that's going to stay. So, I mean we are positioning. We are driving to take advantage of as much of that demand as we can. And it's - I mean, right now today, it's very good out there.",1.1993932,0.0
DHI-2021-Q1-2021-01-26,161,Answer,2021-01-26,1,2021,Jessica L. Hansen,Vice President-Investor Relations & Communications,"A lot of our floor plans in issue actually already incorporated flex space. So depending on what a buyer is looking for today, whether it be a home office, a second home office, a learning space for their kids. Those types of things, we've already always had floor plans that can accommodate that. And we can continue to adjust our starts based on what those homebuyers are potentially looking for.",0.5687039,0.844
DHI-2021-Q1-2021-01-26,162,Answer,2021-01-26,1,2021,Jessica L. Hansen,Vice President-Investor Relations & Communications,"And then the things that have always been true are as people start their families and have children, they generally want a backyard for their kids. They want good public schools, maybe a garage for their cars. Those things have kind of always been true that go along with the demographic side of the equation that David was talking to.",0.0918942,-0.103
DHI-2021-Q1-2021-01-26,165,Answer,2021-01-26,1,2021,Bill W. Wheat,"CFO, Principal Accounting Officer & Executive VP",Yeah.,0.9526124,0.918
DHI-2021-Q1-2021-01-26,166,Answer,2021-01-26,1,2021,Bill W. Wheat,"CFO, Principal Accounting Officer & Executive VP","And that's been a trend that we've been seeing for quite a while. Obviously, we're very well positioned to take advantage of that. The environment right now with low interest rates, that's accommodated for that as well and it's certainly a benefit for that demand as well, which for right now, we don't really see that changing much in the near term.",1.0376671,0.668
DHI-2021-Q1-2021-01-26,168,Question,2021-01-26,1,2021,Michael J. Murray,Chief Operating Officer & Executive Vice President,"Are we in a market where demand is just so strong, it will be difficult to get back to your normal or targeted levels of inventory? Or do you see, as the year progresses here, there could be some progress on that, even if demand does remain, as strong as it has been?",0.039347,0.735
DHI-2021-Q1-2021-01-26,169,Answer,2021-01-26,1,2021,Michael J. Murray,Chief Operating Officer & Executive Vice President,"If demand remains at the exact level it is today, it would be very challenging for us to get back to a historical relationship between total inventory and backlog. Demand is that good. We look at our starts capacity, neighbourhood-by-neighbourhood, week-by-week. And we are increasing that capacity over time to make sure it's sustainable. And we're doing it well with our trade partners in mind.",0.3432398,0.296
DHI-2021-Q1-2021-01-26,170,Answer,2021-01-26,1,2021,Jessica L. Hansen,Vice President-Investor Relations & Communications,"So - but while we're doing that, demand continues to expand, to absorb that additional capacity we're putting into the marketplaces today, at the price points we're serving.",0.083225,0.716
DHI-2021-Q1-2021-01-26,171,Answer,2021-01-26,1,2021,Jessica L. Hansen,Vice President-Investor Relations & Communications,"Really more focused and issue on homes conversion than backlog conversion. I mean, backlog is a function of what we're selling. And we're going to sell, so what's out there from a demand perspective and ultimately, we'll get the house started. We've got the lot positioned to do it unlike anyone else in the industry. We wouldn't be selling the houses if we didn't have the lots and feel comfortable about our cost structure and what kind of return we were going to generate on those houses.",0.7472909,0.908
DHI-2021-Q1-2021-01-26,172,Answer,2021-01-26,1,2021,David V. Auld,President & Chief Executive Officer,"So we're really focused on the houses we have in inventory and how quickly we're turning those and rather than a backlog conversion metric, trying to improve our housing inventory turn. And generally, we turn that at least two times a year. Last year, we did a little bit better than that, this year now with our new guidance, we're reflecting better than two times as well.",0.5555983,0.382
DHI-2021-Q1-2021-01-26,177,Question,2021-01-26,1,2021,Michael J. Murray,Chief Operating Officer & Executive Vice President,And I think we've heard from others that buyers are visiting homes maybe on what used to be off-peak days or off-peak hours. Is that something you've seen? Or can you just comment generally on any kind of changes you've seen in buyer behavior?,0.5939724,0.955
DHI-2021-Q1-2021-01-26,178,Answer,2021-01-26,1,2021,Michael J. Murray,Chief Operating Officer & Executive Vice President,"Yeah. We've certainly seen very different seasonality throughout 2020. Stronger demand through the summer, fall, winter in 2020 than we've seen historically. So we're coming off of some unusually strong periods. But that being said, with what we've seen thus far in January, we're seeing increases in volume that we would expect to see. It remains to be seen whether we'll still see the same percentage relationships between our Q2 and Q1 that we've seen historically or not. But right now, we just see a very strong demand environment. Definitely some different patterns in buyer behavior than we've seen historically. But feeling good about what we can see going ahead.",0.0711595,0.86
DHI-2021-Q1-2021-01-26,179,Answer,2021-01-26,1,2021,Michael J. Murray,Chief Operating Officer & Executive Vice President,"With a very strong Q1, where we see the same sort of patterns throughout the fiscal year, we historically have seen. I would expect there's probably be a bit of flattening of some of the historical patterns, but obviously, off to a very good start. And I think the way things are looking right now, we're optimistic about the spring.",0.6822938,0.893
DHI-2021-Q1-2021-01-26,181,Question,2021-01-26,1,2021,Michael J. Murray,Chief Operating Officer & Executive Vice President,"Or maybe to ask the question another way, do you think your affordability edge is maybe stronger than it was 12 months ago with competitors raising prices? Or any kind of general comments on the pricing environment?",0.368355,0.964
DHI-2021-Q1-2021-01-26,182,Answer,2021-01-26,1,2021,Michael J. Murray,Chief Operating Officer & Executive Vice President,"If you just look at our average sales price increase over quarter-over-quarter-over-quarter compared to our competitors. And yes, I would say our competitive advantage has increased and improved. But again, it really comes down to the ability to deliver the homes. And I think that's where we've gained the largest competitive advantage with the discipline around what we're doing and the focus on efficiency over the last couple of years.",0.2285475,0.846
DHI-2021-Q1-2021-01-26,183,Answer,2021-01-26,1,2021,Michael J. Murray,Chief Operating Officer & Executive Vice President,"So it's a - it doesn't do any good to sell a house at any price, you can't deliver it. So we're focused on the delivery side of it and expanding our capacity via becoming more and more efficient through our processes.",1.2473838,0.572
DHI-2021-Q1-2021-01-26,186,Question,2021-01-26,1,2021,David V. Auld,President & Chief Executive Officer,"Hi. Good morning. We talked a lot about returns. We talked about underwriting, not really focusing on margin. And David, you sound pretty constructive on the land environment. I guess, my question would be thinking about Horton as this longer-term 60-40 option versus owned mix coming in at 72 this quarter. Is 72 the new 60? If the goalposts changed or is it really more of an interim function, that's where the markets kind of brought you in terms of availability of new acquisitions over the last couple of quarters?",0.3432089,0.886
DHI-2021-Q1-2021-01-26,187,Answer,2021-01-26,1,2021,David V. Auld,President & Chief Executive Officer,"Yeah, actually, 70s are new 60. We're going to continue to try to grind that number higher. Ultimately, it comes down to relationships and execution in the field. And that's something we focus on every day. So it's my expectation over time is that we will continue to drag a point here, a point there and drive better and better efficiency, capital efficiency through our business and to our company and ultimately, probably the industry.",1.791843,0.947
DHI-2021-Q1-2021-01-26,188,Question,2021-01-26,1,2021,Michael J. Murray,Chief Operating Officer & Executive Vice President,"Okay. Great. Thanks. And then looking at the single-family rental sale, it would appear that the gross margins on those 124 homes was pretty healthy, it may be in excess of the company margin. Am I looking at that the right way? Or is there something I'm missing? Obviously, you've got your G&A costs and everything below the line. But just from a purely a margin perspective, it looks like that was a really healthy margin on the sale of those units?",0.4269569,0.91
