id,sequence,label,date,quarter,year,speaker,title,text,mystery indicator,VADER sentiment
DHI-2019-Q3-2019-07-30,148,Answer,2019-07-30,3,2019,Jessica L. Hansen,Vice President-Investor Relations & Communications,"Sure, Buck. I think you've kind of hit the nail on the head with how we would start, which is 2021 is a long ways out. So, I think a lot can happen between then. And does it fully expire and go away or does some middle ground be reached between now and then, we'll see. It's a long ways out. In terms of our buyers and their debt to income for the buyers that are utilizing our mortgage company, on average for our entire mortgage company this quarter, the DTI percentage was about 42%. So, we do have a decent amount of our buyers that would be at that 43% or above. But, that doesn't mean just because it's the patch were to go away for conventional, there's not a product for them, they'd still be eligible potentially for an FHA loan. And then, the first question we also always ask is do you have other sources of income that we can verify that we haven't yet, to go into that equation?",0.5405288,0.052
DHI-2019-Q3-2019-07-30,149,Answer,2019-07-30,3,2019,Jessica L. Hansen,Vice President-Investor Relations & Communications,"So typically, any sort of change that gets implemented like that, is not 100% fallout. Our mortgage company just -- mortgage company does a phenomenal job of working with buyers in our pipeline to find them the different products. And if this patch were to expire, which I don't know that that's any of these base case scenario right now, I feel confident that we figure our way through it with without a lot of fallout.",0.5106199,0.691
DHI-2019-Q3-2019-07-30,151,Answer,2019-07-30,3,2019,David V. Auld,President & Chief Executive Officer,"Thanks, Kevin. We appreciate everybody's time on the call today and look forward to speaking with you again in November. And to the D.R. Horton team, outstanding quarter. Thank you. We are forever grateful up here for what you guys do out there. And I guess, we'll talk to you sooner than November.",0.5929204,0.934
DHI-2020-Q3-2020-07-28,2,Remarks,2020-07-28,3,2020,Jessica L. Hansen,Vice President-Investor Relations & Communications,"Thank you, Kevin and good morning. Welcome to our call to discuss our results for the third quarter of fiscal 2020 in addition to current market conditions.",0.9050715,0.813
DHI-2020-Q3-2020-07-28,3,Remarks,2020-07-28,3,2020,Jessica L. Hansen,Vice President-Investor Relations & Communications,"Before we get started, today's call may include comments that constitute forward-looking statements as defined by the Private Securities Litigation Reform Act of 1995. Although D.R. Horton believes any such statements are based on reasonable assumptions, there is no assurance that actual outcomes will not be materially different. All forward-looking statements are based upon information available to D.R. Horton on the date of this conference call and D.R. Horton does not undertake any obligation to publicly update or revise any forward-looking statements. Additional information about issues that could lead to material changes in performance is contained in D.R. Horton's annual report on Form 10-K and subsequent reports on Form 10-Q, all of which are or will be filed with the Securities and Exchange Commission.",0.2314694,0.422
DHI-2020-Q3-2020-07-28,4,Remarks,2020-07-28,3,2020,Jessica L. Hansen,Vice President-Investor Relations & Communications,"This morning's earnings release can be found on our website at investor.drhorton.com and we plan to file our 10-Q in the next day or two. After this call, we will post updated investor and supplementary data presentations to our Investor Relations site on the Presentations section under News & Events for your reference.",0.1330733,0.0
DHI-2020-Q3-2020-07-28,5,Remarks,2020-07-28,3,2020,Jessica L. Hansen,Vice President-Investor Relations & Communications,"Now, I will turn the call over to David Auld, our President and CEO.",0.857824,0.0
DHI-2020-Q3-2020-07-28,6,Remarks,2020-07-28,3,2020,David V. Auld,President & Chief Executive Officer,"Thank you, Jessica and good morning. I am pleased to be joined - to also be joined on this call by Mike Murray, our Executive Vice President and Chief Operating Officer and Bill Wheat, our Executive Vice President and Chief Financial Officer.",1.639092,0.807
DHI-2020-Q3-2020-07-28,7,Remarks,2020-07-28,3,2020,David V. Auld,President & Chief Executive Officer,"We would like to first again express our gratitude to our country's dedicated field of healthcare workers and to all who are on the frontlines caring for our communities. Our thoughts remain with those affected by this pandemic and our priority continues to be the health and safety of our employees, customers, trade partners and the communities we serve. During the latter part of March, the impacts of COVID-19 and related widespread reductions in economic activity across the United States began to negatively affect our business. During April, when restrictive stay-at-home orders were in place for most of our markets, our sales orders decreased and our cancellations increased and our April net sales orders were 1% lower than a year ago. However, as restrictive orders began to be lifted across many markets and economic activity resumed, our sales increased significantly and our cancellations rate returned to normal levels. In both May and June, our net sales orders increased by more than 50% compared to the prior year periods, resulting in a net sales order increase of 38% for the quarter. We sold 5,931 more homes this quarter than the same quarter last year, positioning D.R. Horton to achieve further gains in market share and scale.",1.2843401,0.975
DHI-2020-Q3-2020-07-28,8,Remarks,2020-07-28,3,2020,David V. Auld,President & Chief Executive Officer,"We have continued to see strong increases in net sales orders in July compared to the same month last year. Despite the disruption from COVID-19 on our operations, the D.R. Horton team delivered a record third quarter, including net sales orders of 21,519 homes, a 25% increase in consolidated pre-tax income to $782 million and a 10% increase in revenues to $5.4 billion. Our pre-tax profit margin for the quarter improved 170 basis points to 14.5%, while our EPS increased 37% to $1.72 per diluted share. Our homebuilding return on inventory for the trailing 12 months ended June 30 was 21.6% and our consolidated return on equity for the same period was 19.9%.",1.674875,0.929
DHI-2020-Q3-2020-07-28,9,Remarks,2020-07-28,3,2020,David V. Auld,President & Chief Executive Officer,"While housing market conditions are very strong today, we remain cautious as to the impact that COVID-19 may have on the overall economy and our operations in the future. We believe our strong balance sheet, liquidity position and experienced operating teams, position us very well to operate effectively through changing economic conditions. We plan to maintain our flexible, operational and financial position by generating strong cash flows from our homebuilding operations and managing our product offerings, incentives, home pricing, sales base and inventory levels to optimize return on our inventory investments in each of our communities based on local housing market conditions. Mike?",1.6556368,0.969
DHI-2020-Q3-2020-07-28,10,Remarks,2020-07-28,3,2020,Michael J. Murray,Chief Operating Officer & Executive Vice President,"Diluted earnings per share for the third quarter of fiscal 2020 increased 37% to $1.72 per share compared to $1.26 per share in the prior year quarter. Net income for the quarter increased 33% to $631 million compared to $475 million. The current quarter results, included income tax benefit of $38.1 million related to federal energy efficient home tax credits that were retroactively reinstated earlier in the year.",1.2641272,0.953
DHI-2020-Q3-2020-07-28,11,Remarks,2020-07-28,3,2020,Michael J. Murray,Chief Operating Officer & Executive Vice President,"Our third quarter home sales revenues increased 10% to $5.2 billion on 17,642 homes closed, up from $4.7 billion on 15,971 homes closed in the prior year. Our average closing price for the quarter was essentially flat with last year at $295,200 and the average size of our homes closed was down 3% reflecting our ongoing efforts to keep our homes affordable. Bill?",0.5709502,0.273
DHI-2020-Q3-2020-07-28,12,Remarks,2020-07-28,3,2020,Bill W. Wheat,"CFO, Principal Accounting Officer & Executive VP","Net sales orders in the third quarter increased 38% to 21,519 homes and the value of those orders was $6.3 billion, up 35% from $4.7 billion in the prior year. Our average number of active selling communities was essentially unchanged from both the prior year and sequentially. Our average sales price on net sales orders in the third quarter was $294,500, down 2% from the prior year, primarily due to a decline in the average sales price for our West region as more of the region's mix shifted to our entry level Express brand during the quarter. The cancellation rate for the third quarter was 22%, up from 20% in the prior year quarter.",1.7181045,0.758
DHI-2020-Q3-2020-07-28,13,Remarks,2020-07-28,3,2020,Bill W. Wheat,"CFO, Principal Accounting Officer & Executive VP","Our net sales orders in both May and June increased by more than 50% compared to the prior year periods. We believe the increase in demand after April has been fueled by increased buyer urgency due to lower interest rates, the limited supply of homes at affordable price points, and to some extent, pent-up demand. We were and remain well-positioned for this increased demand with our affordable product offerings, lots supply and housing inventories, particularly completed homes and those close to completion. Jessica?",1.0251114,0.612
DHI-2020-Q3-2020-07-28,14,Remarks,2020-07-28,3,2020,Jessica L. Hansen,Vice President-Investor Relations & Communications,"Our gross profit margin on home sales revenue in the third quarter was 21.6%, up 30 basis points sequentially from the March quarter and up 130 basis points compared to the prior year quarter. We remain focused on managing the pricing incentives and sales pace in each of our communities to optimize the return on our inventory investments and adjust to local market conditions and new home demand. We currently expect our home sales gross margin in the fourth quarter to be similar to the third quarter. However, there is uncertainty regarding the future impacts of COVID-19 on the economy and new home demand, which could negatively impact our gross margins in the future. Bill?",0.5357607,-0.402
DHI-2020-Q3-2020-07-28,15,Remarks,2020-07-28,3,2020,Bill W. Wheat,"CFO, Principal Accounting Officer & Executive VP","In the third quarter, homebuilding SG&A expense, as a percentage of revenues, was 7.9%, down 20 basis points from 8.1% in the prior year quarter. Our homebuilding SG&A expense as a percentage of revenues is at its lowest point in our history and we remain focused on controlling our SG&A while ensuring that our infrastructure appropriately supports our business. Mike?",1.4086675,0.557
DHI-2020-Q3-2020-07-28,16,Remarks,2020-07-28,3,2020,Michael J. Murray,Chief Operating Officer & Executive Vice President,"We ended the third quarter with 32,800 homes in inventory. 12,700 of our total homes were unsold, of which 2,900 were completed. We also had 1,900 model homes at the end of the quarter. Due to our significant increase in sales in May and June, the portion of our backlog that is not yet under construction is higher than normal and our number of completed unsold homes is lower than in recent years. As a result, we have accelerated our pace of home starts across most of our communities to ensure we maintain an adequate number of homes available for sale in each community to meet demand.",0.5182085,0.671
DHI-2020-Q3-2020-07-28,17,Remarks,2020-07-28,3,2020,Michael J. Murray,Chief Operating Officer & Executive Vice President,"At June 30, our homebuilding lot position consisted of approximately 335,000 lots, of which 34% were owned and 66% were controlled through purchase contracts. 32% of our total own lots are finished and at least 52% of our controlled lots are or will be finished when we purchase them. Our current lot portfolio includes an ample supply of lots for homes at affordable price points and continues to provide us a strong competitive position. David?",1.0548347,0.612
DHI-2020-Q3-2020-07-28,18,Remarks,2020-07-28,3,2020,David V. Auld,President & Chief Executive Officer,"Our third quarter homebuilding investment in lots land and development totaled $1.1 billion, of which $390 million was for finished lots, $380 million was for land development, and $290 million was for land. $180 million of our land and lot purchases in the third quarter were for Forestar. After slowing our lots and land and development investments in March and April, we have since increased our pace of investments to ensure we maintain an adequate number of finished lots to support our home construction base. Bill?",1.1100423,0.823
DHI-2020-Q3-2020-07-28,19,Remarks,2020-07-28,3,2020,Bill W. Wheat,"CFO, Principal Accounting Officer & Executive VP","Forestar, our major - our majority owned subsidiary, is a publicly traded residential lot manufacturer operating in 51 markets across 22 states. Our strategic relationship with Forestar as a well-capitalized lot supplier across much of our operating footprint is serving us well during this volatile time and is presenting opportunities for both companies to gain market share. Forestar is delivering on its high growth expectations with revenue growth of more than 200% and net income growth of 80% fiscal year-to-date in 2020. At June 30, Forestar's lot position consisted of 50,700 lots, of which 38,300 are owned and 12,400 are controlled through purchase contracts. 77% of Forestar's owned lots are already under contract with D.R. Horton or subject to a right of first offer under our master supply agreement.",0.2235723,0.96
DHI-2020-Q3-2020-07-28,20,Remarks,2020-07-28,3,2020,Bill W. Wheat,"CFO, Principal Accounting Officer & Executive VP","Forestar is separately capitalized from D.R. Horton and has approximately $700 million of liquidity, which includes $350 million of unrestricted cash and $350 million of available capacity on its revolving credit facility. At June 30, Forestar's net debt-to-capital ratio was 25.2% and their next senior note maturity is in 2024. With low leverage, ample liquidity, and its relationship with D.R. Horton; Forestar is in a very strong position to navigate through changing economic conditions and continue to grow their business. Jessica?",0.2219522,0.624
DHI-2020-Q3-2020-07-28,21,Remarks,2020-07-28,3,2020,Jessica L. Hansen,Vice President-Investor Relations & Communications,"Financial services pre-tax income in the third quarter was $68.8 million with a pre-tax profit margin of 43.9% compared to $48.1 million and 40.2% in the prior year quarter. Despite the disruption in the secondary mortgage markets in March and April caused by COVID-19 and the uncertainty of the impact of the CARES Act, our mortgage company has continued selling the mortgages that originates at strong net gains. We began retaining servicing rights on some of our FHA and VA loan originations during the third quarter due to disruptions among mortgage servicers and we will continue to monitor developments in the mortgage markets and adjust our operations to adapt to changes in market conditions.",0.7247508,0.721
DHI-2020-Q3-2020-07-28,22,Remarks,2020-07-28,3,2020,Jessica L. Hansen,Vice President-Investor Relations & Communications,"For the quarter, 97% of our mortgage company's loan originations related to homes closed by our homebuilding operations and our mortgage company handled the financing for 71% of our home buyers. FHA and VA loans accounted for 53% of the mortgage company's volume. Borrowers originating loans with DHI Mortgage this quarter had an average FICO score of 718 and an average loan-to-value ratio of 91%. First-time homebuyers represented 57% of the closings handled by our mortgage company, reflecting our continued focus on offering homes at affordable price points. Mike?",0.82228,0.0
DHI-2020-Q3-2020-07-28,23,Remarks,2020-07-28,3,2020,Michael J. Murray,Chief Operating Officer & Executive Vice President,"DHI Communities is our multifamily rental company focused on suburban garden style apartments that had four projects under active construction and one project that was substantially complete at the end of the quarter. After selling two projects earlier this fiscal year, no other projects were slated to be marketed and sold during our third or fourth quarters of fiscal 2020.",0.5864378,0.477
DHI-2020-Q3-2020-07-28,24,Remarks,2020-07-28,3,2020,Michael J. Murray,Chief Operating Officer & Executive Vice President,"We expect to market and sell a couple of projects in fiscal 2021, based on our current pace of construction and leasing activity. After pausing construction starts and new acquisitions by DHI Communities in March, April, and May, we began selectively resuming plans for new projects in June and we still plan to grow the DHI Communities platform. DHI Communities assets totaled $225 million at June 30. We also continue to evaluate our opportunities in the market for single family rental homes. We are currently building and leasing homes in nine single family rental communities across our operations, as we are in the early stages of our participation in this growing segment of the housing market. Bill?",1.0096275,0.634
DHI-2020-Q3-2020-07-28,25,Remarks,2020-07-28,3,2020,Bill W. Wheat,"CFO, Principal Accounting Officer & Executive VP","Our balanced capital approach focuses on being disciplined, flexible, and opportunistic. Our strong balance sheet, ample liquidity, and low leverage provide us with significant financial flexibility to effectively operate in changing economic conditions and we plan to maintain our disciplined approach to investing capital to enhance the long-term value of our company.",0.0818145,0.889
DHI-2020-Q3-2020-07-28,26,Remarks,2020-07-28,3,2020,Bill W. Wheat,"CFO, Principal Accounting Officer & Executive VP","During the 9 months ended June, our cash provided by homebuilding operations was $1.2 billion compared to $606 million in the prior year period. At June 30, we had $3.7 billion of homebuilding liquidity consisting of $1.9 billion of unrestricted homebuilding cash and $1.8 billion of available capacity on our homebuilding revolving credit facilities. Our homebuilding leverage was 18.4% at the end of June, was $2.4 billion of homebuilding public notes outstanding, and $400 million of senior note maturities in the next 12 months.",0.3240178,0.765
DHI-2020-Q3-2020-07-28,27,Remarks,2020-07-28,3,2020,Bill W. Wheat,"CFO, Principal Accounting Officer & Executive VP","At June 30, our stockholders equity was $11 billion and book value per share was $30.38, up 16% from a year ago. For the trailing 12 months into June, our return on equity was 19.9% compared to 17.3% a year ago. During the quarter, we paid cash dividends of $64 million and our Board has declared a quarterly dividend at the same level as last quarter to be paid in August. We did not repurchase any shares during the third quarter and we expect to cautiously manage our level of share repurchases in the near-term to maintain financial flexibility until we have better visibility to future market conditions and our expected operating results. Our outstanding share count is down 2% from a year ago and we currently have an outstanding share repurchase authorization of $535 million. Jessica?",0.7646821,0.967
DHI-2020-Q3-2020-07-28,28,Remarks,2020-07-28,3,2020,Jessica L. Hansen,Vice President-Investor Relations & Communications,"As we noted last quarter, due to the uncertainty in the U.S. economy and our business operations from COVID-19, we withdrew our guidance for fiscal 2020. Based on today's market conditions, we are now providing our expectations for the fourth quarter of fiscal 2020. In the fourth quarter, we expect to generate consolidated revenues in the range of $5.5 billion to $5.8 billion and to close approximately 18,000 to 19,000 homes. We expect our home sales gross margin in the fourth quarter to be similar to the third quarter in the mid 21% range and humbling SG&A in the fourth quarter to be 8% to 8.2% of homebuilding revenues. We anticipate a financial services pre-tax profit margin in the fourth quarter of approximately 40% and we expect our income tax rate to be approximately 23%. We plan to provide annual guidance for fiscal 2021 when we have sufficient visibility into market conditions hopefully on our next earnings call in early November. David?",1.7897703,0.026
DHI-2020-Q3-2020-07-28,29,Remarks,2020-07-28,3,2020,David V. Auld,President & Chief Executive Officer,"In closing, our results reflect the strength of our experienced operational teams and it's relating market share, broad geographic footprint and diverse product offerings across multiple brands. Our strong balance sheet, ample liquidity and low leverage provide us with significant financial flexibility to effectively operate in changing economic conditions. And we plan to maintain our disciplined approach to investing capital to enhance the long-term value of our company. Thank you to the entire D.R. Horton team for your focus and hard work. Your efforts during this time have been remarkable. We are proud of your work ethic and your positive spirit as you safely continue helping our customers close on their much anticipated new homes. This concludes our prepared remarks. We will now host questions.",4.0411697,0.987
DHI-2020-Q3-2020-07-28,32,Answer,2020-07-28,3,2020,David V. Auld,President & Chief Executive Officer,"Labor has been a challenge throughout this entire market cycle. So, we focused early on, on driving efficiency through the operation, partnering with our labor trades and have seen the benefit of that all the way through this cycle. The reality is, as I think Mike will tell you, the build cycles continue to be very, very stable and just the process of how we build and how we treat our trades has proven to be very effective in managing this situation.",0.8641785,0.948
DHI-2020-Q3-2020-07-28,34,Answer,2020-07-28,3,2020,Bill W. Wheat,"CFO, Principal Accounting Officer & Executive VP","Good morning, Alan. We continue to evaluate different opportunities and it still comes down to where we can add, add to the long-term value of the company, where we can add product and new customer base to serve, but more importantly, people that are accretive to the operating teams. So we continue to talk with several private builders, where we are more inclined to look at the tuck-ins that we have done either adding to existing markets or opening up new markets for us. But you won't see us probably do any massive public acquisitions, but I do think we will continue to evaluate the smaller privates.",0.055083,0.781
DHI-2020-Q3-2020-07-28,36,Answer,2020-07-28,3,2020,Bill W. Wheat,"CFO, Principal Accounting Officer & Executive VP","I would say, it's both and it's going to vary based upon the situation of a particular private builder as to whether they are thinking it's still a good place to be or if it's time for them to do something different and to join a bigger operation.",3.9530174,0.625
DHI-2020-Q3-2020-07-28,39,Answer,2020-07-28,3,2020,David V. Auld,President & Chief Executive Officer,I will add that we don't - we are not in a position where we need to go at. And it really does have to be a great fit and at this point they would have to want to join our family and it's not going to be a stretch kind of a win-win for them and us.,0.1962293,0.844
DHI-2020-Q3-2020-07-28,41,Question,2020-07-28,3,2020,Stephen Kim,Citigroup,"Thanks very much, guys. Yes, I wanted to follow-up on the cycle time and spec question that Alan just asked. So you mentioned cycle times are very stable. That's obviously extremely encouraging and exemplary, I would say. But we have seen your specs are down and obviously demand has surged significantly. So I guess the bottom line question for me is would you like to increase your spec levels from where they are today and are you able to do so in an environment, where demand is as strong as it has been?",0.0662154,0.953
DHI-2020-Q3-2020-07-28,42,Answer,2020-07-28,3,2020,Michael J. Murray,Chief Operating Officer & Executive Vice President,"Answer to your first question, yes, Stephen, we would like to increase our spec levels today. We have aggressive starts planned to increase our specs. At the same time, we will be starting our sold homes. And so it is a big plan to start houses. But as David mentioned before, we have been focusing early on, on the efficiency, in the product, in the operational focus and partnering with our trades and being true that they are capable of supporting the growth that we have in front of us. So we do think we will be able to increase our spec inventory, but it's not going to be without a lot of effort, I can promise you that.",3.0242779,0.925
DHI-2020-Q3-2020-07-28,43,Answer,2020-07-28,3,2020,David V. Auld,President & Chief Executive Officer,"The focus right now is on driving a consistent sustainable start program, week to week, project by project. And as we continue to execute that, I think our spec accounts will come to what we historically have carried.",1.1773759,0.0
