id,sequence,label,date,quarter,year,speaker,title,text,mystery indicator,VADER sentiment
DHI-2019-Q2-2019-04-25,107,Question,2019-04-25,2,2019,Stephen Kim,Citigroup,"Yeah. So you are kind of drawing a distinction between the way you would approach M&A in other words, being basically your personnel-oriented and talent-oriented as opposed to what we have seen from, let's say, Pulte most recently in terms of primarily being asset acquisitions, right?",1.7071807,0.572
DHI-2019-Q2-2019-04-25,108,Answer,2019-04-25,2,2019,David V. Auld,President & Chief Executive Officer,"It certainly is as a component of the overall acquisition, but the determining factor for us is generally going to be the people and the talent rather than simply the lot position or the lot portfolio. That is what justifies for us the effort, expense, and potential risk you have with an acquisition is the long-term playback of adding to your platform.",1.8280108,0.412
DHI-2019-Q2-2019-04-25,112,Question,2019-04-25,2,2019,Michael Rehaut,JPMorgan Chase,"Thanks. Good morning, everyone. First question I had was just kind of the pace that you have seen over the last two months or three months, perhaps, relative to your expectations, so far as some of the other builders have reported, they have pointed to not just seasonal improvement, but a little bit of improved year-over-year trends. In other words, the year-over-year growth improving as well from January to February and to March, maybe not every month, but certainly towards the end of the quarter, and perhaps even into April. So I was curious if you could give us a sense if that year-over-year growth accelerated as well particularly on a sales pace basis. And when you talk to similarly incentives improving sequentially, obviously, they are still up year-over-year, I was wondering if that year-over-year delta on incentives perhaps has moderated as well.",0.6464174,0.99
DHI-2019-Q2-2019-04-25,113,Answer,2019-04-25,2,2019,Jessica L. Hansen,Vice President-Investor Relations & Communications,"Mike, we generally don't comment on individual months within a quarter in terms of the year-over-year improvement. As David said, we are very pleased with our sales pace. We did see normal seasonality as we move throughout the quarter from month to month to month, and incentives for us are always on a community-by-community basis.",0.8439532,0.817
DHI-2019-Q2-2019-04-25,114,Answer,2019-04-25,2,2019,Jessica L. Hansen,Vice President-Investor Relations & Communications,"So we have got communities where we have been able to roll those back fully from what we have had to do in the fall and we have got some that still have some elevated incentives out there. But as we continue to move throughout the spring, we are hopeful that we can continue to dial those back in communities, where maybe we haven't been able to fully yet.",1.935414,0.681
DHI-2019-Q2-2019-04-25,115,Answer,2019-04-25,2,2019,David V. Auld,President & Chief Executive Officer,I would say we are not seeing anything outside of normal seasonality. It's been a good spring. It's been a solid spring. But we would say it's consistent with what we would expect to see in normal seasonality thus far.,1.770681,0.542
DHI-2019-Q2-2019-04-25,116,Question,2019-04-25,2,2019,Michael Rehaut,JPMorgan Chase,"Okay. So unless I am interpreting that differently, it seems like perhaps again on a year-over-year trend basis, again, I know you kind of punted on the month-to-month, but it does, it sounds like normal seasonality means that, again, unless I am reading the tea leaves of your answer a little too finally that, perhaps, it was more steady it sounds like rather than improvement. I guess, second question maybe just to zone in on a region here. Appreciate the color commentary on Texas. Another big focal point has been California, and in particular, some of the real improvements month-to-month over the last two months or three months, 4Q was pretty rough. Just wanted to get a sense again if there's been anything outside of normal seasonality or would you say that by contract anything a little bit more from an acceleration standpoint?",0.7392523,0.941
DHI-2019-Q2-2019-04-25,117,Answer,2019-04-25,2,2019,Michael J. Murray,Chief Operating Officer & Executive Vice President,"I spent the last four to six weeks traveling our California market, driving communities, very impressed with the effort execution of our teams out there. I don't think our California market is on fire by any stretch of the imagination. But I will say in my world, effort and execution is what separates us from our competitors and I was very happy with what I saw from our people.",0.5680201,0.717
DHI-2019-Q2-2019-04-25,118,Answer,2019-04-25,2,2019,Michael J. Murray,Chief Operating Officer & Executive Vice President,"The overall market in California appears to be getting a little better. It was not good in the first quarter and there's some portions of it that had -- gives you a sense that it is coming back fairly well. We are focusing as affordable as you can be in California. I was very happy with what I saw, I will say that.",0.9024697,0.743
DHI-2019-Q2-2019-04-25,119,Answer,2019-04-25,2,2019,Jessica L. Hansen,Vice President-Investor Relations & Communications,"And, Mike, when we post our supplemental data after the call, you will see we have been talking a lot about in the west part of our issue had just been getting the communities online and this is the first quarter in several quarters our west region community count on average is up 5% year-over-year and it's even up 4% sequentially. So we are getting those new communities online and we are very excited about the product that we are bringing to market.",0.0043346,0.401
DHI-2019-Q2-2019-04-25,120,Answer,2019-04-25,2,2019,Bill W. Wheat,"CFO, Principal Accounting Officer & Executive VP",And I think you will see those new communities contribute more meaningful in Q3 and Q4 to sales than in the first month  the first quarter of their opening.,0.2895909,0.38
DHI-2019-Q2-2019-04-25,127,Question,2019-04-25,2,2019,Ken Zener,Keybanc,So could you just start with your spec completed number?,0.8522648,0.0
DHI-2019-Q2-2019-04-25,128,Answer,2019-04-25,2,2019,Bill W. Wheat,"CFO, Principal Accounting Officer & Executive VP","It's 5,300.",0.4025921,0.0
DHI-2019-Q2-2019-04-25,129,Question,2019-04-25,2,2019,Ken Zener,Keybanc,"Okay. And I apologize, just kind of going through calls this morning. But you gave guidance for 14,500 to 15,000, is that correct for 3Q?",0.2418118,0.318
DHI-2019-Q2-2019-04-25,133,Question,2019-04-25,2,2019,Ken Zener,Keybanc,"So let me ask you this question. If you look at your units in inventory, it appears that your conversion rate of closing is decelerating versus kind of the past, which would imply and that's been happening in recent quarters, so it's one of two things, obviously, there's fair demand or your inventory on average is just a little bit younger. Is it because your -- why is that, is it because you are building more specs and you just tend to have more younger inventory versus something that was more backlog-ish and what exactly was the intra-quarter order of closings, please?",0.8885017,0.202
DHI-2019-Q2-2019-04-25,134,Answer,2019-04-25,2,2019,Bill W. Wheat,"CFO, Principal Accounting Officer & Executive VP",Intra-quarter closings would be those that we sold and closed in the same quarter. I believe it was over 40%...,0.9485622,0.0
DHI-2019-Q2-2019-04-25,136,Answer,2019-04-25,2,2019,Bill W. Wheat,"CFO, Principal Accounting Officer & Executive VP","in the second quarter. Looking at the age of our inventory, the number of unsold homes that we have in inventory completed over six months was the same at March 31, 2019 as it was at March 31, 2018. So the inventory is still young, to use your word.",1.1948157,0.077
DHI-2019-Q2-2019-04-25,137,Answer,2019-04-25,2,2019,Bill W. Wheat,"CFO, Principal Accounting Officer & Executive VP","And looking at that, we did have some I don't want to use the W word, but we did have some events this quarter that effected some production. So we do have some of those completions coming a little bit later, from the winter and into the early spring.",0.9327663,0.039
DHI-2019-Q2-2019-04-25,138,Question,2019-04-25,2,2019,Ken Zener,Keybanc,"Yeah. How -- okay. Let me look at this another way. I mean, obviously, you guys are issuing guidance, because the last six months are pretty much already growing vertical. How do you think about your spec position as it relates to backlog? So, obviously, you want to achieve even flow, which you do that by reducing your December quarter units in inventory as much as you did historically and others do which helps you with market share. But how do you think about how you are running spec versus what you are seeing in terms of orders. I mean, you always going to keep basically your units under construction at a 2:1 ratio backlog? Is that your approach in general or how should we think about how that spec will turn relative to the lower industry growth rate that we are seeing?",0.4968641,0.923
DHI-2019-Q2-2019-04-25,139,Answer,2019-04-25,2,2019,Michael J. Murray,Chief Operating Officer & Executive Vice President,"Generally, we look at a snapshot of inventory position of around 50% of sold to unsold homes in total inventory that will vary higher and lower at different points in the year. But -- and that's sort of a result of every one of our operating divisions evaluating their communities one by one, looking at a trailing sales pace along with an expected forward sales pace based upon where they are in the year and what they are seeing in those sub-markets.",0.2235245,-0.296
DHI-2019-Q2-2019-04-25,140,Answer,2019-04-25,2,2019,Michael J. Murray,Chief Operating Officer & Executive Vice President,"And then they are adjusting their spec inventory kind of relative to the construction cycle of that community and managing it week-to-week-to-week based on sales, closing and production completions. And there are varying starts on that basis, so the sum result of it comes up to about a 50% ratio plus or minus throughout the year.",0.2787777,0.0
DHI-2019-Q2-2019-04-25,145,Answer,2019-04-25,2,2019,Bill W. Wheat,"CFO, Principal Accounting Officer & Executive VP","I think, yes, we touched on for spec completions, as well as a bit of an elongated demand cycle this spring is what got displaced from the market in the fall. Still the same people that want to live in a home from the fall. Still want to live in a home. They still have a housing need, and we are positioned to supply that need this summer.",0.1887404,0.599
DHI-2019-Q2-2019-04-25,147,Answer,2019-04-25,2,2019,Jessica L. Hansen,Vice President-Investor Relations & Communications,"Sure. So, Matthew, we saw actually 20 basis points of impact in our March quarter. Honestly, probably a little bit lighter than we would have expected. We did  not that we like to talk about weather, but some of our acquisitions are in markets that do experience a little bit more extreme weather than a lot of the markets we already operated in. So a little bit of that purchase accounting impact has been delayed really until this quarter, Q3 and into Q4. So wouldn't be surprised if that 20 basis points of impact in March ticks up in June.",0.0975293,0.359
DHI-2019-Q2-2019-04-25,150,Question,2019-04-25,2,2019,Nishu Sood,Deutsche Bank,"Thank you. Just wanted to ask about the DHI Communities, appreciate the incremental details on that. Now that part of your business seems to be maturing, just wondering if you could give us some kind of broad brush strokes on how you expect that to grow, how big a part of the business it can become, what regions of the country you might ultimately expect it to be and then whether it would kind of stick to the garden style apartments or whether it might broaden in terms of product lines. Just wanted to kind of get whatever longer-term visions you can provide right now?",0.1357143,0.727
DHI-2019-Q2-2019-04-25,151,Answer,2019-04-25,2,2019,David V. Auld,President & Chief Executive Officer,"We are, I think, very happy with the progress to-date, building out a team, identifying sites. The whole key for us is sustainable and scalable. So it's going to play very closely in with our homebuilding operations. The sites that we are building on right now are pieces of property that were a part of our larger communities where we are building houses.",0.9603694,0.848
DHI-2019-Q2-2019-04-25,152,Answer,2019-04-25,2,2019,David V. Auld,President & Chief Executive Officer,"It seems very synergistic to what we are trying to accomplish. It allows us to reach affordability of buyers or not buyers, but homeowners, future homeowners, it gives them -- we start a relationship with them, so we are very excited about it.",0.4501731,0.669
DHI-2019-Q2-2019-04-25,153,Answer,2019-04-25,2,2019,David V. Auld,President & Chief Executive Officer,"I think right now, we have four projects under construction. Two pretty much completed and were in lease-up and a pipeline of deals across the country of more than 20. So, over time, it's going to be a pretty significant business for us.",1.4205464,0.802
DHI-2019-Q2-2019-04-25,154,Question,2019-04-25,2,2019,Nishu Sood,Deutsche Bank,Got it. Thanks.,0.2367857,0.44
DHI-2019-Q2-2019-04-25,155,Answer,2019-04-25,2,2019,Michael J. Murray,Chief Operating Officer & Executive Vice President,"And from some very early-stage projects to more robust further down the line. We still expect the next couple of years, we are not going to see a sale of recorder, but there will be occasional sales as we deliver the first set of projects that have been in the pipeline the last couple of years, but then over the longer term certainly expect some growth there.",0.3771452,0.81
DHI-2019-Q2-2019-04-25,156,Question,2019-04-25,2,2019,Nishu Sood,Deutsche Bank,"Got it. Thanks. So coming back to the annual guidance, I know there's been a lot of questions about it and it's been a very difficult environment over the past six months to nine months to even think about what '19 might have looked like. Investors generally looking at the market, rates have fallen, the outlook for the year, obviously, from what builders have been saying has improved. And so just wanted to dig into how are you reflecting that in your guidance that you have given? I mean, if you look at the volume guidance, for example, acquisitions are a big part of it and gross margins you are expecting some modest improvement. So -- and of course we appreciate your more kind of level approach to giving guidance through these periods of volatility, but how should we think about how your guidance is reflecting improvement in demand that the market has seen in recent months, should we think about their potentially being more upside against your guidance or it's a de-risk to guidance or how should we think about that?",0.1221429,0.803
DHI-2019-Q2-2019-04-25,157,Answer,2019-04-25,2,2019,Jessica L. Hansen,Vice President-Investor Relations & Communications,"I would tell you the first thing I would take away is we feel good enough to give guidance again. So that to me is the biggest takeaway is that the spring has been good enough. We felt comfortable to sit here today and provide that level of guidance. We will continue to update quarterly as we can, but with six months left in the year, the houses we have under construction, the spring sales we have seen to-date.",0.2982228,0.619
DHI-2019-Q2-2019-04-25,158,Answer,2019-04-25,2,2019,Jessica L. Hansen,Vice President-Investor Relations & Communications,"As -- we don't want to put guidance out there, we don't feel comfortable that we can hit, but I'd tell you that we think the 55,000 to 56,000 annual homes is a very realistic range at what we would expect to deliver for this year.",0.3927178,0.318
DHI-2019-Q2-2019-04-25,159,Question,2019-04-25,2,2019,Nishu Sood,Deutsche Bank,Got it. Thank you.,0.6439286,0.361
DHI-2019-Q2-2019-04-25,162,Answer,2019-04-25,2,2019,Michael J. Murray,Chief Operating Officer & Executive Vice President,"Currently, we are in a kind of a build-for-sale operation. We would evaluate alternative capital structures. David mentioned before, we are looking for something that's scalable and sustainable and that would certainly be more accretive to returns in that business. First thing for us was simplistically wanting to figure out and kind of understand the business and looking at how we can build that business as sort of a combination with our homebuilding platform across the country.",0.034324,0.34
DHI-2019-Q2-2019-04-25,163,Answer,2019-04-25,2,2019,Michael J. Murray,Chief Operating Officer & Executive Vice President,"So a lot of the initial pipeline that we have been working within current projects have largely been on land parcels that are part of larger master plans we have been developing and building homes in and rather than in the past typically selling off those corners of land to other developers, look to develop the capabilities to monetize that land and add that value ourselves. So as we look to roll it out forward and accelerate it, we would certainly be looking at the capitalization of that business with a lot of options open in front of us.",0.125157,0.586
DHI-2019-Q2-2019-04-25,165,Answer,2019-04-25,2,2019,Michael J. Murray,Chief Operating Officer & Executive Vice President,"In terms of the Horton Capital Plan, no plans to pay off the next maturity early, we will be then evaluating our cash flow, our investment plans for fiscal 2020 and as we put those plans together, we will determine whether we simply pay that debt off or whether we refinance all or a portion of that.",0.1113437,-0.671
DHI-2019-Q2-2019-04-25,166,Answer,2019-04-25,2,2019,Michael J. Murray,Chief Operating Officer & Executive Vice President,"In terms of Forestar Capital, very pleased with the progress that has been made with respect to building the capital stack at Forestar. Them issuing their first issuance of senior notes here in April was an important step to getting the capital to start making investments for fiscal '21 revenues for Forestar.",0.4838845,0.872
DHI-2019-Q2-2019-04-25,167,Answer,2019-04-25,2,2019,Michael J. Murray,Chief Operating Officer & Executive Vice President,"Certainly equity is in the plans as well, and we want to be prepared and in position for Forestar to issue equity when the opportunity presents itself. I have been very pleased that Forestar now has three equity analysts covering them, and the management team at Forestar really alongside the Horton team here as well is starting to hold more meetings with investors. We will begin attending some investor conferences and basically getting the story out there.",0.073671,0.915
DHI-2019-Q2-2019-04-25,168,Answer,2019-04-25,2,2019,Michael J. Murray,Chief Operating Officer & Executive Vice President,I would encourage investors to look at the Investor deck that's on the Forestar website. It's very helpful in describing the lot manufacturing business model at Forestar and certainly look forward to them being able to expand their float in the future.,0.2059439,0.878
DHI-2019-Q2-2019-04-25,169,Answer,2019-04-25,2,2019,Jessica L. Hansen,Vice President-Investor Relations & Communications,And Forestar will start having a stand-alone conference call beginning in the June quarter.,0.1265713,0.0
DHI-2019-Q2-2019-04-25,173,Answer,2019-04-25,2,2019,Bill W. Wheat,"CFO, Principal Accounting Officer & Executive VP","Sure. We do have some cost tailwinds that we do expect to start coming through our closing in Q3, primarily from lumber pricings having dropped in the latter part of '18 and as we have talked about a bit as we have been able to pull back our incentives gradually through the spring, that should result in some improved margins versus the closing we have seen in Q2, say, those are our primary factors that we would expect to see some sequential or potential for margin improvement.",0.1850952,0.866
DHI-2019-Q2-2019-04-25,175,Answer,2019-04-25,2,2019,Jessica L. Hansen,Vice President-Investor Relations & Communications,"So on your first question, our absorption kind of on the same-store basis is up 1% year-over-year and it was up 49% sequentially. So that's kind of right in line with traditional seasonality and even ex-acquisitions and then the second question?",0.4828782,0.0
DHI-2019-Q2-2019-04-25,177,Answer,2019-04-25,2,2019,Jessica L. Hansen,Vice President-Investor Relations & Communications,"Oh! Well, our community count did tick-up organically this quarter and then even further because of the acquisitions, so I'd anticipate the community count remaining up through the remainder of the year. We will see what comes from absorption versus communities, but we haven't given a specific guide to sales.",0.36671,0.212
DHI-2019-Q2-2019-04-25,183,Answer,2019-04-25,2,2019,David V. Auld,President & Chief Executive Officer,"We are very happy with the performance of all the brands. I mean, we are growing Freedom. I think that's going to be a very important part of our future offerings. Emerald has stayed fairly steady at about 3% of our deliveries. The Horton brand maintains dominance and Express, it's pretty much fully rolled out, so I think that 30, 35 may go up a little bit, percent of deliveries will remain constant.",0.0400154,0.943
DHI-2019-Q2-2019-04-25,185,Answer,2019-04-25,2,2019,Jessica L. Hansen,Vice President-Investor Relations & Communications,"No. Su, I mean, we do expect that cost moderation to primarily come from lumber as it pertains to other material inputs. We have always got some costs that are rising, but we generally find ways to offset those so we would expect lumber to be a tailwind to gross margin in the back half of the year.",0.36671,-0.696
DHI-2019-Q2-2019-04-25,186,Answer,2019-04-25,2,2019,Jessica L. Hansen,Vice President-Investor Relations & Communications,"Labor costs haven't come down, even with some of the softness. But in terms of trade availability, that's helped a little bit as some builders have slowed their starts this spring as compared to maybe what was anticipated.",0.4694408,0.0
DHI-2019-Q2-2019-04-25,187,Answer,2019-04-25,2,2019,Jessica L. Hansen,Vice President-Investor Relations & Communications,"I don't think we have given our revenue and stick-and-brick per square foot yet that we typically provide on the call, so on a year-over-year basis our revenues per square foot were up about 2% versus our stick-and-brick costs which were up 4%, so that goes right in line with the year-over-year decline in gross margin we saw. Sequentially that was a much tighter range. Our revenue per square foot was essentially flat and our stick-and-brick cost per square foot was just very, very slightly up.",0.1924577,-0.477
DHI-2019-Q2-2019-04-25,191,Answer,2019-04-25,2,2019,David V. Auld,President & Chief Executive Officer,"Something we are always looking at opportunities, Alex, and as we get further into that, if we get further into that, we will certainly let you know.",0.0350135,0.612
DHI-2019-Q2-2019-04-25,193,Answer,2019-04-25,2,2019,Michael J. Murray,Chief Operating Officer & Executive Vice President,"If the question is have we given it any thought, absolutely, w watch everything going on in the industry.",1.5115111,0.0
DHI-2019-Q2-2019-04-25,195,Answer,2019-04-25,2,2019,David V. Auld,President & Chief Executive Officer,"We have not given specific guidance, Alex. We are still in the early stage. This was the first project sale in the multi-family division. We do have four projects under construction and two projects that are substantially completed in the lease-up phase.",1.1819931,0.0
DHI-2019-Q2-2019-04-25,196,Answer,2019-04-25,2,2019,David V. Auld,President & Chief Executive Officer,So we sort of would expect we would have two projects in the coming quarters. But we don't expect to see a sale every quarter. So we are not in a position yet to provide more specific guidance than that.,0.6213928,0.0
DHI-2019-Q2-2019-04-25,199,Answer,2019-04-25,2,2019,David V. Auld,President & Chief Executive Officer,"Thank you, Kevin. We appreciate everyone's time on the call today and look forward to speaking to you again in July to share the third quarter results and to the D.R. Horton team, incredibly proud of what you guys have accomplished out there over the last six months. I just want to thank you.",0.1573682,0.938
DHI-2020-Q2-2020-04-28,3,Remarks,2020-04-28,2,2020,Jessica L. Hansen,Vice President-Investor Relations & Communications,"Thank you, Sherry, and good morning. Welcome to our call to discuss our results for the second quarter of fiscal 2020 in addition to current market conditions.",0.0433463,0.813
DHI-2020-Q2-2020-04-28,4,Remarks,2020-04-28,2,2020,Jessica L. Hansen,Vice President-Investor Relations & Communications,"Before we get started, today's call may include comments that constitute forward-looking statements as defined by the Private Securities Litigation Reform Act of 1995. Although D.R. Horton believes any such statements are based on reasonable assumptions, there is no assurance that actual outcomes will not be materially different.",0.254443,0.153
DHI-2020-Q2-2020-04-28,5,Remarks,2020-04-28,2,2020,Jessica L. Hansen,Vice President-Investor Relations & Communications,"All forward-looking statements are based upon information, available to D.R. Horton on the date of this conference call and D.R. Horton does not undertake any obligation to publicly update or revise any forward-looking statements. Additional information about issues that could lead to material changes in performance is contained in D.R. Horton's annual report on Form 10-K and our subsequent reports on Form 10-Q, all of which are filed with the Securities and Exchange Commission.",0.172085,0.296
